<?xml version="1.0"?>
<!DOCTYPE plugin SYSTEM "manifest.dtd">
<plugin version="2">
	<info>
		<version>0.2</version>
		<name>gmaps</name>
		<title>Google Maps Plugin</title>
		<author>Zarafa</author>
		<authorURL>http://www.zarafa.com</authorURL>
		<description>Shows contact address on google maps.</description>
	</info>
	<config>
		<configfile>config.php</configfile>
	</config>
	<components>
		<component>
			<files>
				<server>
					<serverfile>php/plugin.gmaps.php</serverfile>
				</server>
				<client>
					<clientfile load="release">js/gmaps.js</clientfile>
					<clientfile load="debug">js/gmaps-debug.js</clientfile>
					<clientfile load="source">js/GmapsPlugin.js</clientfile>
					<clientfile load="source">js/GmapsTab.js</clientfile>
				</client>
			</files>
		</component>
	</components>
</plugin>