<?xml version="1.0"?>
<!DOCTYPE plugin SYSTEM "manifest.dtd">
<plugin version="2">
	<info>
		<version>1.1</version>
		<name>clockwidget</name>
		<title>Clock Widget</title>
		<author>Zarafa</author>
		<authorURL>http://www.zarafa.com</authorURL>
		<description>Displays a clock in the WebApp Dashboard</description>
	</info>
	<components>
		<component>
			<files>
				<client>
					<clientfile load="release">js/clockwidget.js</clientfile>
					<clientfile load="debug">js/clockwidget-debug.js</clientfile>
					<clientfile load="source">js/ClockWidget.js</clientfile>
				</client>
			</files>
		</component>
	</components>
</plugin>
