<?xml version="1.0"?>
<!DOCTYPE plugin SYSTEM "manifest.dtd">
<plugin version="2">
	<info>
		<version>0.2</version>
		<name>feedback</name>
		<title>Feedback collector plugin</title>
		<author>Zarafa</author>
		<authorURL>http://www.zarafa.com</authorURL>
		<description>Adds a 'got feedback' button so all users
		  can give feedback directly to Zarafa.</description>
	</info>
	<config>
		<configfile>config.php</configfile>
	</config>
	<components>
		<component>
			<files>
				<server>
					<serverfile>php/plugin.feedback.php</serverfile>
				</server>
				<client>
					<clientfile load="release">js/feedback.js</clientfile>
					<clientfile load="debug">js/feedback-debug.js</clientfile>
					<clientfile load="source">js/jiratrigger.js</clientfile>
					<clientfile load="source">js/ABOUT.js</clientfile>
				</client>
			</files>
		</component>
	</components>
</plugin>
