<?xml version="1.0"?>
<!DOCTYPE plugin SYSTEM "manifest.dtd">
<plugin version="2">
	<info>
		<version>1.1</version>
		<name>statslogging</name>
		<title>User Interface Statistics Logging</title>
		<author>Zarafa</author>
		<authorURL>http://www.zarafa.com</authorURL>
		<description>Logging of the user inferface interaction statistics</description>
	</info>
	<config>
		<configfile>config.php</configfile>
	</config>
	<components>
		<component>
			<files>
				<server>
					<serverfile>php/plugin.statslogging.php</serverfile>
					<serverfile type="module" module="pluginstatsloggingmodule">php/class.pluginstatsloggingmodule.php</serverfile>
				</server>
				<client>
					<clientfile load="release">js/statslogging.js</clientfile>
					<clientfile load="debug">js/statslogging-debug.js</clientfile>
					<clientfile load="source">js/StatsLogging.js</clientfile>
				</client>
			</files>
		</component>
	</components>
</plugin>
