<?xml version="1.0"?>
<!DOCTYPE plugin SYSTEM "manifest.dtd">
<plugin version="2">
	<info>
		<version>0.2</version>
		<name>facebookwidget</name>
		<title>Facebook widget</title>
		<author>Zarafa</author>
		<authorURL>http://www.zarafa.com</authorURL>
		<description>Facebook widget</description>
	</info>
	<components>
		<component>
			<files>
				<client>
					<clientfile load="release">js/facebookwidget.js</clientfile>
					<clientfile load="debug">js/facebookwidget-debug.js</clientfile>
					<clientfile load="source">js/FBWidget.js</clientfile>
				</client>
			</files>
		</component>
	</components>
</plugin>
